<?xml version="1.0"?>
<xs:schema xmlns:xs="http://www.w3.org/2001/XMLSchema">

  <xs:element name="student">
    <xs:complexType>
      <xs:sequence>
        <xs:element name="course" maxOccurs="8">
          <xs:complexType>
            <xs:sequence>
              <xs:element name="title" type="xs:string"/>
              <xs:element name="description" type="xs:string"/>
            </xs:sequence>
            <xs:attribute name="id" type="xs:string" use="required"/>
            <xs:attribute name="startdate" type="xs:date" use="required"/>
            <xs:attribute name="enddate" type="xs:date" use="required"/>
          </xs:complexType>
        </xs:element>
      </xs:sequence>
      <xs:attribute name="id" type="xs:int" use="required"/>
      <xs:attribute name="firstname" type="xs:string" use="required"/>
      <xs:attribute name="lastname" type="xs:string" use="required"/>
    </xs:complexType>
  </xs:element>

</xs:schema>
